id,nimi,kirjeldus,valmistamise_aeg,raskusaste,koostisosad,valmistamise_juhend
"1","Kana Tikka Masala","India klassikaline roog vürtsika kastme ja mahlase kanaliha tükikestega.","45","3","Kanafilee, sibul, küüslauk, tomatipasta, jogurt, vürtsisegu, riis","Koori ja haki sibul ning küüslauk. Lõika kanafilee tükkideks. Kuumuta pannil õli ja prae sibulat ning küüslauku kuni need on pehmed. Lisa kanafilee tükid pannile ja prae neid, kuni need on kuldpruunid. Sega juurde tomatipasta, jogurt ja vürtsisegu ning hauta madalal kuumusel umbes 30 minutit. Serveeri kuumade riisiga."
"2","Spagetid Bolognese","Klassikalised spagetid lihakastme ja maitserohelisega.","30","2","Spagetid, hakkliha, sibul, küüslauk, tomatikaste, oliiviõli, maitseroheline","Keeda spagetid soolases vees vastavalt pakendil olevatele juhistele. Kuumuta pannil oliiviõli ja prae hakitud sibulat ning küüslauku, kuni need muutuvad klaasjaks. Lisa hakkliha pannile ja prae seda, kuni see muutub pruuniks. Sega juurde tomatikaste ja hauta madalal kuumusel 10-15 minutit. Serveeri spagette kastme ja maitserohelisega."
"3","Kartulisalat","Värskendav ja maitsev kartulisalat köögiviljade ja majoneesikastmega.","20","1","Kartul, kurk, tomat, sibul, muna, majonees, maitseained","Keeda kartulid ja munad ning lase neil jahtuda. Lõika kartulid, munad, kurgid, tomatid ja sibul väikesteks tükkideks. Sega kõik koostisosad suures kausis kokku. Lisa majonees ja maitseained ning sega kõik hoolikalt läbi. Lase salatil enne serveerimist mõnda aega külmkapis maitsestuda."
"4","Kana Caesar Salat","Värskendav salat krõbedate kanafilee tükkidega, Caesar kastme ja krutoonidega.","25","2","Kanafilee, jääsalat, krutoonid, parmesani juust, Caesar kaste","Lõika kanafilee tükkideks ja prae neid kuni need on küpsed ja krõbedad. Rebi jääsalat tükkideks ja pane salatikausse. Lisa kanafilee tükid salatile. Puista peale krutoonid ja riivitud parmesani juust. Nirista üle Caesar kastmega ja serveeri kohe."
"5","Köögiviljapasta","Maitsev taimetoidupasta erinevate köögiviljadega.","35","2","Spagetid, paprika, suvikõrvits, porgand, sibul, küüslauk, oliiviõli, maitseained","Keeda spagetid soolases vees vastavalt pakendil olevatele juhistele. Lõika köögiviljad ribadeks või tükikesteks. Kuumuta pannil oliiviõli ja prae köögivilju keskmisel kuumusel umbes 10-15 minutit, kuni need on pehmed. Lisa keedetud spagetid köögiviljadele ja sega kõik hoolikalt läbi. Maitsesta pasta vajadusel lisades soola, pipart ja muid maitseaineid ning serveeri kohe."
"6","Šokolaadikook","Magus ja rikkalik šokolaadikook koos šokolaadiglasuuriga.","50","3","Nisujahu, suhkur, kakao, küpsetuspulber, sool, munad, piim, või, šokolaad","Kuumuta ahi 180 kraadini ja määri küpsetusvorm võiga. Sega omavahel jahu, suhkur, kakao, küpsetuspulber ja sool suures kausis. Lisa sulatatud või, munad ja piim ning sega tainas ühtlaseks. Vala tainas ettevalmistatud vormi ja küpseta 45-50 minutit või kuni kook on läbi küpsenud. Sulata šokolaad ja kata kook sellega. Lase koogil jahtuda enne serveerimist."
"7","Kanapada Tai moodi","Aroomikas Tai stiilis kanapada värskete ürtide ja kookospiimaga.","40","4","Kanafilee, kookospiim, punane karri pasta, ingver, küüslauk, laimilehed, värsked ürdid","Lõika kanafilee tükkideks ja prae neid kuni need on küpsed. Tõsta kõrvale. Kuumuta potis kookospiim, lisades sinna punase karri pasta, hakitud ingverit ja küüslauku. Lisa kanatükid tagasi potti ja hauta madalal kuumusel 20 minutit. Lisa laimilehed ja hakitud värsked ürdid ning hauta veel 5 minutit. Serveeri koos riisiga."
"8","Köögiviljasupp","Kerge ja tervislik köögiviljasupp erinevate värskete köögiviljadega.","30","1","Porgand, kartul, brokoli, sibul, küüslauk, köögiviljapuljong, maitseained","Koori ja tükelda köögiviljad. Kuumuta potis veidi õli ja prae hakitud sibul ja küüslauk kuni need on